{
  "db_pool": {
    "method": "pg_stat_activity (server-side pool occupancy proxy)",
    "samples": [
      {
        "active": 0,
        "elapsed_seconds": 0.00008943799184635282,
        "source": "pg_stat_activity",
        "total": 41,
        "waiting": 0
      },
      {
        "active": 0,
        "elapsed_seconds": 1.00013774598483,
        "source": "pg_stat_activity",
        "total": 41,
        "waiting": 0
      },
      {
        "active": 0,
        "elapsed_seconds": 2.000146145001054,
        "source": "pg_stat_activity",
        "total": 41,
        "waiting": 0
      },
      {
        "active": 0,
        "elapsed_seconds": 3.000186716992175,
        "source": "pg_stat_activity",
        "total": 41,
        "waiting": 0
      },
      {
        "active": 0,
        "elapsed_seconds": 4.000162626995007,
        "source": "pg_stat_activity",
        "total": 41,
        "waiting": 0
      },
      {
        "active": 0,
        "elapsed_seconds": 5.00013137399219,
        "source": "pg_stat_activity",
        "total": 41,
        "waiting": 0
      },
      {
        "active": 0,
        "elapsed_seconds": 6.000139446987305,
        "source": "pg_stat_activity",
        "total": 41,
        "waiting": 0
      },
      {
        "active": 0,
        "elapsed_seconds": 7.0001415649894625,
        "source": "pg_stat_activity",
        "total": 41,
        "waiting": 0
      },
      {
        "active": 0,
        "elapsed_seconds": 8.000144966994412,
        "source": "pg_stat_activity",
        "total": 41,
        "waiting": 0
      },
      {
        "active": 0,
        "elapsed_seconds": 9.000165599980392,
        "source": "pg_stat_activity",
        "total": 41,
        "waiting": 0
      },
      {
        "active": 0,
        "elapsed_seconds": 10.000155633984832,
        "source": "pg_stat_activity",
        "total": 41,
        "waiting": 0
      },
      {
        "active": 0,
        "elapsed_seconds": 11.000143419980304,
        "source": "pg_stat_activity",
        "total": 41,
        "waiting": 0
      },
      {
        "active": 0,
        "elapsed_seconds": 12.000149920990225,
        "source": "pg_stat_activity",
        "total": 41,
        "waiting": 0
      },
      {
        "active": 0,
        "elapsed_seconds": 13.000141405995237,
        "source": "pg_stat_activity",
        "total": 41,
        "waiting": 0
      },
      {
        "active": 0,
        "elapsed_seconds": 14.000144616002217,
        "source": "pg_stat_activity",
        "total": 41,
        "waiting": 0
      },
      {
        "active": 0,
        "elapsed_seconds": 15.000150499981828,
        "source": "pg_stat_activity",
        "total": 41,
        "waiting": 0
      },
      {
        "active": 0,
        "elapsed_seconds": 16.000139380979817,
        "source": "pg_stat_activity",
        "total": 41,
        "waiting": 0
      },
      {
        "active": 0,
        "elapsed_seconds": 17.00015817399253,
        "source": "pg_stat_activity",
        "total": 41,
        "waiting": 0
      },
      {
        "active": 0,
        "elapsed_seconds": 18.00021149899112,
        "source": "pg_stat_activity",
        "total": 41,
        "waiting": 0
      },
      {
        "active": 0,
        "elapsed_seconds": 19.000180290982826,
        "source": "pg_stat_activity",
        "total": 41,
        "waiting": 0
      },
      {
        "active": 0,
        "elapsed_seconds": 20.000151830987306,
        "source": "pg_stat_activity",
        "total": 41,
        "waiting": 0
      },
      {
        "active": 0,
        "elapsed_seconds": 21.000171928986674,
        "source": "pg_stat_activity",
        "total": 41,
        "waiting": 0
      },
      {
        "active": 0,
        "elapsed_seconds": 22.0001709839853,
        "source": "pg_stat_activity",
        "total": 41,
        "waiting": 0
      },
      {
        "active": 0,
        "elapsed_seconds": 23.00016683098511,
        "source": "pg_stat_activity",
        "total": 41,
        "waiting": 0
      },
      {
        "active": 0,
        "elapsed_seconds": 24.000151468993863,
        "source": "pg_stat_activity",
        "total": 41,
        "waiting": 0
      },
      {
        "active": 0,
        "elapsed_seconds": 25.00016212198534,
        "source": "pg_stat_activity",
        "total": 41,
        "waiting": 0
      },
      {
        "active": 0,
        "elapsed_seconds": 26.00014732297859,
        "source": "pg_stat_activity",
        "total": 41,
        "waiting": 0
      },
      {
        "active": 0,
        "elapsed_seconds": 27.00014633400133,
        "source": "pg_stat_activity",
        "total": 41,
        "waiting": 0
      },
      {
        "active": 0,
        "elapsed_seconds": 28.000172690983163,
        "source": "pg_stat_activity",
        "total": 41,
        "waiting": 0
      },
      {
        "active": 0,
        "elapsed_seconds": 29.000162323995028,
        "source": "pg_stat_activity",
        "total": 41,
        "waiting": 0
      },
      {
        "active": 0,
        "elapsed_seconds": 30.000181741983397,
        "source": "pg_stat_activity",
        "total": 41,
        "waiting": 0
      },
      {
        "active": 0,
        "elapsed_seconds": 31.000170601997524,
        "source": "pg_stat_activity",
        "total": 41,
        "waiting": 0
      },
      {
        "active": 0,
        "elapsed_seconds": 32.000139873998705,
        "source": "pg_stat_activity",
        "total": 41,
        "waiting": 0
      },
      {
        "active": 1,
        "elapsed_seconds": 33.000154073000886,
        "source": "pg_stat_activity",
        "total": 42,
        "waiting": 0
      },
      {
        "active": 0,
        "elapsed_seconds": 34.00013866799418,
        "source": "pg_stat_activity",
        "total": 41,
        "waiting": 0
      },
      {
        "active": 0,
        "elapsed_seconds": 35.0001468739938,
        "source": "pg_stat_activity",
        "total": 41,
        "waiting": 0
      },
      {
        "active": 0,
        "elapsed_seconds": 36.0001706139883,
        "source": "pg_stat_activity",
        "total": 41,
        "waiting": 0
      },
      {
        "active": 0,
        "elapsed_seconds": 37.00014424897381,
        "source": "pg_stat_activity",
        "total": 41,
        "waiting": 0
      },
      {
        "active": 0,
        "elapsed_seconds": 38.00012652599253,
        "source": "pg_stat_activity",
        "total": 41,
        "waiting": 0
      },
      {
        "active": 0,
        "elapsed_seconds": 39.00016837898875,
        "source": "pg_stat_activity",
        "total": 41,
        "waiting": 0
      },
      {
        "active": 0,
        "elapsed_seconds": 40.00011674797861,
        "source": "pg_stat_activity",
        "total": 41,
        "waiting": 0
      },
      {
        "active": 0,
        "elapsed_seconds": 41.00015303798136,
        "source": "pg_stat_activity",
        "total": 41,
        "waiting": 0
      },
      {
        "active": 0,
        "elapsed_seconds": 42.000123326986795,
        "source": "pg_stat_activity",
        "total": 41,
        "waiting": 0
      },
      {
        "active": 0,
        "elapsed_seconds": 43.00015453598462,
        "source": "pg_stat_activity",
        "total": 41,
        "waiting": 0
      },
      {
        "active": 1,
        "elapsed_seconds": 44.00017896699137,
        "source": "pg_stat_activity",
        "total": 41,
        "waiting": 1
      },
      {
        "active": 0,
        "elapsed_seconds": 45.000137873983476,
        "source": "pg_stat_activity",
        "total": 41,
        "waiting": 0
      },
      {
        "active": 1,
        "elapsed_seconds": 46.00019045599038,
        "source": "pg_stat_activity",
        "total": 41,
        "waiting": 0
      },
      {
        "active": 1,
        "elapsed_seconds": 47.000139602983836,
        "source": "pg_stat_activity",
        "total": 41,
        "waiting": 1
      },
      {
        "active": 0,
        "elapsed_seconds": 48.0001937179768,
        "source": "pg_stat_activity",
        "total": 41,
        "waiting": 0
      },
      {
        "active": 0,
        "elapsed_seconds": 49.00017832199228,
        "source": "pg_stat_activity",
        "total": 41,
        "waiting": 0
      },
      {
        "active": 1,
        "elapsed_seconds": 50.00014259497402,
        "source": "pg_stat_activity",
        "total": 41,
        "waiting": 1
      },
      {
        "active": 1,
        "elapsed_seconds": 51.000183592987014,
        "source": "pg_stat_activity",
        "total": 41,
        "waiting": 1
      },
      {
        "active": 0,
        "elapsed_seconds": 52.00017703999765,
        "source": "pg_stat_activity",
        "total": 41,
        "waiting": 0
      },
      {
        "active": 1,
        "elapsed_seconds": 53.000151829997776,
        "source": "pg_stat_activity",
        "total": 41,
        "waiting": 1
      },
      {
        "active": 2,
        "elapsed_seconds": 54.00057223899057,
        "source": "pg_stat_activity",
        "total": 41,
        "waiting": 0
      },
      {
        "active": 1,
        "elapsed_seconds": 55.00019661398255,
        "source": "pg_stat_activity",
        "total": 41,
        "waiting": 1
      },
      {
        "active": 1,
        "elapsed_seconds": 56.000167020974914,
        "source": "pg_stat_activity",
        "total": 41,
        "waiting": 0
      },
      {
        "active": 2,
        "elapsed_seconds": 57.00017639997532,
        "source": "pg_stat_activity",
        "total": 41,
        "waiting": 1
      },
      {
        "active": 1,
        "elapsed_seconds": 58.05177277198527,
        "source": "pg_stat_activity",
        "total": 41,
        "waiting": 0
      },
      {
        "active": 0,
        "elapsed_seconds": 59.000175945984665,
        "source": "pg_stat_activity",
        "total": 41,
        "waiting": 0
      },
      {
        "active": 0,